{
  "$schema": "http://json-schema.org/draft-07/schema#",
  "$id": "tavora.module.schema.json",
  "title": "Tavora module manifest (tavora.module.json), apiVersion 1",
  "description": "Describes a Tavora module package. Tavora Desktop rejects a manifest with unknown fields instead of ignoring them. The TypeScript validator in @tavora/module-schema is the reference; this schema is checked against it in tests.",
  "type": "object",
  "additionalProperties": false,
  "required": [
    "id",
    "name",
    "version",
    "apiVersion",
    "entry",
    "games",
    "viewport",
    "permissions"
  ],
  "properties": {
    "$schema": {
      "type": "string",
      "description": "Lets editors find this schema. Ignored by Tavora."
    },
    "id": {
      "type": "string",
      "maxLength": 128,
      "pattern": "^[a-z][a-z0-9]*(\\.[a-z0-9][a-z0-9-]*){1,4}$",
      "description": "Unique module id: publisher.module-name, lowercase and dot-separated. Never change it after release: data and permissions are keyed on it.",
      "examples": [
        "community.example.campaign-companion"
      ]
    },
    "name": {
      "type": "string",
      "minLength": 1,
      "maxLength": 80,
      "pattern": "\\S",
      "description": "Name shown to players."
    },
    "description": {
      "type": "string",
      "minLength": 1,
      "maxLength": 300,
      "pattern": "\\S",
      "description": "One or two sentences shown in the module picker."
    },
    "version": {
      "type": "string",
      "pattern": "^(0|[1-9]\\d*)\\.(0|[1-9]\\d*)\\.(0|[1-9]\\d*)(-[0-9A-Za-z.-]+)?$",
      "description": "Module version, semver.",
      "examples": [
        "1.0.0"
      ]
    },
    "apiVersion": {
      "const": "1",
      "description": "Manifest and bridge contract version. Only \"1\" exists."
    },
    "minTavora": {
      "type": "string",
      "pattern": "^(0|[1-9]\\d{0,5})\\.(0|[1-9]\\d{0,5})\\.(0|[1-9]\\d{0,5})$",
      "description": "The oldest Tavora the module works with. An older Tavora refuses to install or load it and says why.",
      "examples": [
        "0.18.0"
      ]
    },
    "entry": {
      "type": "string",
      "allOf": [
        {
          "$ref": "#/definitions/packagePath"
        },
        {
          "pattern": "\\.html$"
        }
      ],
      "description": "HTML page Tavora loads, relative to the package root.",
      "examples": [
        "dist/index.html"
      ]
    },
    "icon": {
      "type": "string",
      "allOf": [
        {
          "$ref": "#/definitions/packagePath"
        },
        {
          "pattern": "\\.(png|webp)$"
        }
      ],
      "description": "Square PNG or WebP icon inside the package, at least 128 × 128 pixels.",
      "examples": [
        "assets/icon.png"
      ]
    },
    "changelog": {
      "type": "string",
      "allOf": [
        {
          "$ref": "#/definitions/packagePath"
        },
        {
          "pattern": "\\.json$"
        }
      ],
      "description": "A JSON file inside the package with the module's patch notes: an array of { version, date, notes } objects, newest first. Players see them in Settings > Modules. Needs Tavora 0.18.2 or newer.",
      "examples": [
        "changelog.json"
      ]
    },
    "homepage": {
      "type": "string",
      "maxLength": 300,
      "pattern": "^https?://[^\\s\\u0000-\\u001f/?#@\\\\]+(?:[/?#][^\\s\\u0000-\\u001f\\\\]*)?$",
      "description": "The module's web page, http or https. Shown in the catalog; Tavora opens it like a module link.",
      "examples": [
        "https://example.com/campaign-companion"
      ]
    },
    "screenshots": {
      "type": "array",
      "minItems": 1,
      "maxItems": 5,
      "uniqueItems": true,
      "items": {
        "type": "string",
        "allOf": [
          {
            "$ref": "#/definitions/packagePath"
          },
          {
            "pattern": "\\.(png|webp)$"
          }
        ]
      },
      "description": "Up to 5 PNG or WebP pictures inside the package, at most 1 MB each, shown in the catalog before installing.",
      "examples": [
        [
          "assets/screenshot-1.png"
        ]
      ]
    },
    "games": {
      "type": "array",
      "items": {
        "type": "string",
        "pattern": "^[a-z0-9][a-z0-9-]{0,63}$"
      },
      "description": "Game ids this module is made for. Empty means any game.",
      "examples": [
        [
          "poe2"
        ]
      ]
    },
    "workspaces": {
      "type": "boolean",
      "description": "Whether the module may be added to a personal workspace, which belongs to no game. Only for modules with an empty games list; leave it out for true, set false for a module that only makes sense in a game. Needs Tavora 0.18.1 or newer.",
      "default": true
    },
    "viewport": {
      "$ref": "#/definitions/viewport",
      "description": "Panel sizes in CSS pixels. Tavora never makes the panel smaller than the minimum."
    },
    "panels": {
      "type": "array",
      "minItems": 1,
      "maxItems": 16,
      "description": "Named panel types the module offers, such as Inventory and Build planner. Players add each on its own and may open several copies; all share the module's saved content and permissions. Ids must be unique and at most one type sets continues.",
      "items": {
        "type": "object",
        "additionalProperties": false,
        "required": [
          "id",
          "name"
        ],
        "properties": {
          "id": {
            "type": "string",
            "pattern": "^[a-z][a-z0-9-]{0,31}$",
            "description": "Stable identity of the panel type, never shown. Saved layouts keep it, so never change it after release.",
            "examples": [
              "build-planner"
            ]
          },
          "name": {
            "type": "string",
            "minLength": 1,
            "maxLength": 24,
            "pattern": "\\S",
            "description": "Short name on the panel's tab.",
            "examples": [
              "Build planner"
            ]
          },
          "entry": {
            "type": "string",
            "allOf": [
              {
                "$ref": "#/definitions/packagePath"
              },
              {
                "pattern": "\\.html$"
              }
            ],
            "description": "The page for this type. The module's entry when left out."
          },
          "icon": {
            "type": "string",
            "allOf": [
              {
                "$ref": "#/definitions/packagePath"
              },
              {
                "pattern": "\\.(png|webp)$"
              }
            ],
            "description": "Tab icon for this type. The module's icon when left out."
          },
          "viewport": {
            "$ref": "#/definitions/viewport",
            "description": "Sizes for this type. The module's viewport when left out."
          },
          "continues": {
            "type": "boolean",
            "description": "Panels opened before the module had panel types become this type. Without it, the first type."
          }
        }
      }
    },
    "permissions": {
      "type": "object",
      "additionalProperties": false,
      "required": [
        "network"
      ],
      "description": "What the module asks for. Each permission needs the player's grant before it works; the player is asked when they first add the module.",
      "properties": {
        "network": {
          "type": "array",
          "maxItems": 32,
          "uniqueItems": true,
          "description": "Exact public host names the module may reach through network.fetch, such as api.example.com. HTTPS only; no scheme, port, wildcard, IP address or local name.",
          "items": {
            "type": "string",
            "maxLength": 253,
            "pattern": "^(?:[a-z0-9](?:[a-z0-9-]{0,61}[a-z0-9])?\\.)+(?!(?:[0-9]+|localhost|local|internal|arpa)$)[a-z0-9](?:[a-z0-9-]{0,61}[a-z0-9])?$"
          }
        },
        "connectors": {
          "type": "array",
          "uniqueItems": true,
          "description": "Parts of Tavora that hold a sign-in, which the module asks to use without seeing the token. ai-usage reads the usage of the player's Claude and Codex accounts; discord talks to the Discord app on this PC (voice channels, who is talking, joining and muting).",
          "items": {
            "enum": [
              "ai-usage",
              "discord"
            ]
          }
        },
        "webAssembly": {
          "type": "boolean",
          "description": "Lets the page compile WebAssembly. Only Tavora's own modules may ask for it; any other module that does is not loaded."
        }
      }
    }
  },
  "definitions": {
    "dimension": {
      "type": "integer",
      "minimum": 1,
      "maximum": 10000
    },
    "packagePath": {
      "type": "string",
      "minLength": 1,
      "maxLength": 256,
      "pattern": "^(?!/)(?!.*//)(?!(.*/)?\\.\\.?(/|$))[^\\\\:\\u0000]+$",
      "description": "Relative path inside the package: no leading slash, no '.' or '..' segments, no backslashes or colons."
    },
    "viewport": {
      "type": "object",
      "additionalProperties": false,
      "required": [
        "minWidth",
        "minHeight"
      ],
      "properties": {
        "minWidth": {
          "$ref": "#/definitions/dimension"
        },
        "minHeight": {
          "$ref": "#/definitions/dimension"
        },
        "preferredWidth": {
          "$ref": "#/definitions/dimension"
        },
        "preferredHeight": {
          "$ref": "#/definitions/dimension"
        }
      }
    }
  }
}
