{
  "$schema": "../../packages/module-schema/schema/tavora.module.schema.json",
  "id": "tavora.notes",
  "name": "Notes",
  "description": "Notes for this game, with a scratchpad, pins and search. Saved as you type.",
  "version": "0.2.0",
  "apiVersion": "1",
  "entry": "dist/index.html",
  "games": [],
  "viewport": { "minWidth": 300, "minHeight": 240, "preferredWidth": 640, "preferredHeight": 600 },
  "permissions": { "network": [] }
}
