{
  "$schema": "../../../../../packages/module-schema/schema/tavora.module.schema.json",
  "id": "local.test.discord-probe",
  "name": "Discord Probe",
  "description": "A test module that asks the discord connector for things, for the e2e tests.",
  "version": "0.0.0",
  "apiVersion": "1",
  "entry": "index.html",
  "games": [],
  "viewport": { "minWidth": 320, "minHeight": 240 },
  "permissions": { "network": [], "connectors": ["discord"] }
}
