{
  "$schema": "../../../../../packages/module-schema/schema/tavora.module.schema.json",
  "id": "local.test.welcome-probe",
  "name": "Welcome Probe",
  "description": "A test module that shows a welcome in its dialog when it is added, for the e2e tests.",
  "version": "0.0.0",
  "apiVersion": "1",
  "minTavora": "0.21.95",
  "entry": "index.html",
  "games": [],
  "viewport": {
    "minWidth": 320,
    "minHeight": 240
  },
  "panels": [
    {
      "id": "welcome",
      "name": "Welcome Probe",
      "continues": true
    },
    {
      "id": "other",
      "name": "Other"
    }
  ],
  "permissions": {
    "network": []
  }
}
