{
  "$schema": "../../../../packages/module-schema/schema/tavora.module.schema.json",
  "id": "local.test.network-module",
  "name": "Network Test Module",
  "version": "0.0.0",
  "apiVersion": "1",
  "entry": "index.html",
  "games": [],
  "viewport": { "minWidth": 320, "minHeight": 240 },
  "permissions": { "network": ["api.tavora.test", "cdn.tavora.test"] }
}
