{
  "$schema": "../../packages/module-schema/schema/tavora.module.schema.json",
  "id": "local.example.vanilla-module",
  "name": "Vanilla Test Module",
  "description": "Example module without a framework. Shows every SDK feature with test ids for the end-to-end tests.",
  "version": "0.0.0",
  "apiVersion": "1",
  "entry": "dist/index.html",
  "games": [],
  "viewport": { "minWidth": 320, "minHeight": 240 },
  "permissions": { "network": [] }
}
